date|post_id|platform|status|content|text_hash|campaign|topic
2026-03-24|69c16f16de9ecf3202249f86|facebook|PUBLISHED|Lab tracking GLP-1 expanded: oral semaglutide boom 170k prescriptions|d91b77135e6de540|march-week4-2026|lab-tracking
2026-03-25|69c16f54251d0953643216c6|facebook|PUBLISHED|Health budget expanded: Medicare drug price reductions and tracking|6fa64425ad2c166f|march-week4-2026|health-budget
2026-03-26|69c16f6ec935ea861a51a65d|facebook|PUBLISHED|Data ownership expanded: years of health data held hostage by apps|497f04dec1cd3aa5|march-week4-2026|data-ownership
2026-03-27|69c16f8ef4d01252241c3e0e|facebook|PUBLISHED|Blog promo expanded: practical guide for switching medication trackers|b93172a612af8804|march-week4-2026|blog-promo
2026-03-30|69c1707a816dece94da51f5d|facebook|PUBLISHED|All-in-one expanded: four logins four data silos no full picture|f7d3e8d30cfc8bc2|march-week4-2026|all-in-one
2026-03-31|69c1b7d9da6152af25e05686|facebook|PUBLISHED|"Washout windows matter more than most people track.

TrackMe+ Dose Cycles logs each compound cycle from start to finish: start date, planned duration, washout period. Close out a cycle, rate effectiveness, note any side effects. Over time you build a real record of what worked and when you were ready to start again.

No more guessing. trackmeplus.com

#MedicationTracking #HealthTracking #CompoundTracking #ChronicIllness #WellnessJourney"|ffef1e141861a66a|march-week4-2026|dose-cycles
2026-03-28|69c6e565c82d8cf2de3ac3f4|facebook|PUBLISHED|Weekend health tracking — stay consistent|66f4e2b71fdcf12e|march-week4-2026|weekend-consistency
2026-03-29|69c6e56db726c546a907bb89|facebook|PUBLISHED|Sunday reset — review your health logs|d8a48ec44246d1a1|march-week4-2026|week-prep

Most people either juggle too many tools or just stop tracking altogether. Neither option is great when your health depends on staying organized.

TrackMe+ puts medications, labs, blood pressure, weight, supply levels, and spending in one place. One app across your phone, computer, and Apple Watch.

Free to start. No credit card.

trackmeplus.com

#HealthTracking #MedicationManagement #HealthApp #TrackMePlus #DigitalHealth"|63b21cdff46c5a50|april-week1-2026|content-series
2026-04-03|69c8701f4137ed0a8244a4c9|facebook|SCHEDULED|"Your doctor orders labs. You get the results. Maybe you glance at the red and green flags. Then they go in a drawer.

But tracking lab results over time is where the real insight lives. One cholesterol reading means little. A year of readings shows whether things are heading the right direction.

We wrote about why this matters and how to actually do it.

docs.trackmeplus.com/2026/03/31/why-tracking-lab-results-matters

#LabResults #HealthData #TrackYourHealth #TrackMePlus #KnowYourNumbers"|6b6eef55c53aa963|april-week1-2026|content-series
2026-04-07|69c8702749c5ffc657f96718|facebook|SCHEDULED|"Managing medications for a parent or loved one is one of those jobs that sounds simple until you're doing it. Multiple prescriptions, different dosing schedules, refill dates, and lab results to track between doctor visits.

TrackMe+ Family Plan lets you set up a dedicated account for your loved one. Track their meds, labs, and health data. Up to 4 accounts, each fully featured.

trackmeplus.com

#CaregiverLife #MedicationManagement #FamilyHealth #HealthTracking #CaregiverSupport"|be369f173e139cf1|april-week2-2026|content-series
2026-04-08|69c870314137ed0a8244a5e9|facebook|SCHEDULED|"If you're tracking health for more than one person, you know the pain. Dad's blood pressure meds, Mom's supplements, your own prescriptions. Different schedules, different pharmacies, different everything.

TrackMe+ Family Plan covers up to 4 people. Each person gets their own account with full medication, lab, and health tracking. Set one up for a loved one, or let them use it independently.

trackmeplus.com

#HealthApp #CaregiverTools #MedicationTracker #FamilyCare #HealthTech"|fd4415024e82eff3|april-week2-2026|content-series
2026-04-09|69c8703c4137ed0a8244a93b|facebook|SCHEDULED|"""Mom takes 7 medications. I was using sticky notes and a spreadsheet."" We hear this a lot.

The sticky note system works until it doesn't. A medication changes, a refill date shifts, and suddenly the whole system falls apart. TrackMe+ replaces that fragile setup with one app that tracks doses, refill dates, lab results, and supply levels. Set it up once and the app keeps everything current.

trackmeplus.com

#CaregiverStory #MedManagement #AgingParents #HealthOrganization #TrackMePlus"|9bcbc16efa1ad8ac|april-week2-2026|content-series
2026-04-01|69c9977c43da8d5fcf0e0ef0|facebook|SCHEDULED|Meds in one app. Labs in another. Blood pressure in a notebook. Costs in... nowhere, probably.|9d68c426524cfb01|april-week1-2026|content-series
2026-04-18|69c86eea|facebook|SCHEDULED|One lab report is a snapshot. A year of lab reports is a story.|111e5f16a1d480f7|april-week3-2026|lab-tracking
2026-04-21|69c86ef2|facebook|SCHEDULED|Here's a number most people can't answer off the top of their head: what do you spend on health each month?|2a402e18cd446c44|april-week4-2026|health-budget
2026-04-04|69cbbba402b7f62a5820a1e4|facebook|SCHEDULED|Consistent tracking is the difference between reacting to your health and managing it.|7112942301368e4f|april-gap-2026|daily-routine
2026-04-06|69cbbbadb4bd6620e552716c|facebook|SCHEDULED|53 million Americans are managing someone else's health. A parent's prescriptions. A spouse's lab results. A child's med|1f648e901bd47355|april-gap-2026|caregiver
